software,software_description,software_versions,resource
OpenSubdiv,OpenSubdiv is a set of open source libraries that implement high performance subdivision surface (subdiv) evaluation on massively parallel CPU and GPU architectures.,3.6.0,aces
Optuna,"Optuna is an automatic hyperparameter optimization software framework, particularly designed for machine learning. It features an imperative, define-by-run style user API. Thanks to our define-by-run API, the code written with Optuna enjoys high modularity, and the user of Optuna can dynamically construct the search spaces for the hyperparameters.",3.1.0,aces
PAPI,"PAPI provides the tool designer and application engineer with a consistent interface and methodology for use of the performance counter hardware found in most major microprocessors. PAPI enables software engineers to see, in near real time, the relation between software performance and processor events. In addition Component PAPI provides access to a collection of components that expose performance measurement opportunites across the hardware and software stack.",7.0.1,aces
PCRE,The PCRE library is a set of functions that implement regular expression pattern matching using the same syntax and semantics as Perl 5.,"8.44, 8.45",aces
PCRE2,The PCRE library is a set of functions that implement regular expression pattern matching using the same syntax and semantics as Perl 5.,"10.36, 10.37, 10.40, 10.42",aces
PDAL,PDAL is a C++ library for translating and manipulating point cloud data.,"2.4.3, 2.6.0",aces
PDT,"Program Database Toolkit (PDT) is a framework for analyzing source code written in several programming languages and for making rich program knowledge accessible to developers of static and dynamic analysis tools. PDT implements a standard program representation, the program database (PDB), that can be accessed in a uniform way through a class library supporting common PDB operations.",3.25.1,aces
PETSc,"PETSc, pronounced PET-see (the S is silent), is a suite of data structures and routines for the scalable (parallel) solution of scientific applications modeled by partial differential equations.","3.17.4, 3.19.2, 3.19.2-64bit, 20231020-CUDA-11.8.0, 20231023-CUDA-11.8.0, 20231110-CUDA-11.8.0",aces
PLUMED,"PLUMED is an open source library for free energy calculations in molecular systems which works together with some of the most popular molecular dynamics engines. Free energy calculations can be performed as a function of many order parameters with a particular focus on biological problems, using state of the art methods such as metadynamics, umbrella sampling and Jarzynski-equation based steered MD. The software, written in C++, can be easily interfaced with both fortran and C/C++ codes.","2.7.2, 2.7.3, 2.8.0, 2.8.1, 2.9.0",aces
PMIx,"Process Management for Exascale Environments PMI Exascale (PMIx) represents an attempt to provide an extended version of the PMI standard specifically designed to support clusters up to and including exascale sizes. The overall objective of the project is not to branch the existing pseudo-standard definitions - in fact, PMIx fully supports both of the existing PMI-1 and PMI-2 APIs - but rather to (a) augment and extend those APIs to eliminate some current restrictions that impact scalability, and (b) provide a reference implementation of the PMI-server that demonstrates the desired level of scalability.","3.1.5, 3.2.3, 4.1.0, 4.1.2, 4.2.2, 4.2.4, 4.2.5, 4.2.6, 5.0.1",aces
POV-Ray,"The Persistence of Vision Raytracer, or POV-Ray, is a ray tracing program which generates images from a text-based scene description, and is available for a variety of computer platforms. POV-Ray is a high-quality, Free Software tool for creating stunning three-dimensional graphics. The source code is available for those wanting to do their own ports.",3.7.0.10,aces
PRANK,"PRANK is a probabilistic multiple alignment program for DNA, codon and amino-acid sequences. PRANK is based on a novel algorithm that treats insertions correctly and avoids over-estimation of the number of deletion events.",170427,aces
PROJ,Program proj is a standard Unix filter function which converts geographic longitude and latitude coordinates into cartesian coordinates,"7.2.1, 8.0.1, 8.1.0, 9.0.0, 9.1.1, 9.2.0",aces
PRRTE,"The PMIx Reference Runtime Environment is a reference run-time environment that utilizes the PMIx API. It mainly provides run-time environment infrastructure for environments that do not natively have them. In practical terms, this typically means providing infrastructure for non-scheduled environments that have no concept of distributed scheduling, file staging, remote stdout/stderr redirection, and only have ssh to execute commands on remote nodes.",3.0.2,aces
PYTHIA,"PYTHIA is a program for the generation of high-energy physics collision events, i.e. for the description of collisions at high energies between electrons, protons, photons and heavy nuclei. It contains theory and models for a number of physics aspects, including hard and soft interactions, parton distributions, initial- and final-state parton showers, multiparton interactions, fragmentation and decay. It is largely based on original research, but also borrows many formulae and other knowledge from the literature. As such it is categorized as a general purpose Monte Carlo event generator.",8.309,aces
PadicoTM,PM2 is an umbrella software suite for high-performance runtime systems. Modules may be installed and used together or separately.,20220531,aces
Pango,"Pango is a library for laying out and rendering of text, with an emphasis on internationalization. Pango can be used anywhere that text layout is needed, though most of the work on Pango so far has been done in the context of the GTK+ widget toolkit. Pango forms the core of text and font handling for GTK+-2.x.","1.48.5, 1.48.8, 1.50.7, 1.50.12, 1.50.14",aces
ParMETIS,"ParMETIS is an MPI-based parallel library that implements a variety of algorithms for partitioning unstructured graphs, meshes, and for computing fill-reducing orderings of sparse matrices. ParMETIS extends the functionality provided by METIS and includes routines that are especially suited for parallel AMR computations and large scale numerical simulations. The algorithms implemented in ParMETIS are based on the parallel multilevel k-way graph-partitioning, adaptive repartitioning, and parallel multi-constrained partitioning schemes.",4.0.3,aces
ParaFold,This project is a modified version of DeepMind's AlphaFold2 to achieve high-throughput protein structure prediction.,2.0-CUDA-11.8.0,aces
ParaView,ParaView is the world’s leading open source post-processing visualization engine.,"5.11.1-MPI-Linux64, 5.12.0-MPI-Linux64",aces
Parabricks,Clara Parabricks is a GPU-accelerated software suite for performing secondary analysis of next generation sequencing DNA and RNA data.,4.1.1,aces
Perl,Larry Wall's Practical Extraction and Report Language This is a minimal build without any modules. Should only be used for build dependencies.,"5.32.0-minimal, 5.32.0, 5.32.1-minimal, 5.32.1, 5.34.0-minimal, 5.34.0, 5.34.1-minimal, 5.34.1, 5.36.0-minimal, ...",aces
Pillow,Pillow is the 'friendly PIL fork' by Alex Clark and Contributors. PIL is the Python Imaging Library by Fredrik Lundh and Contributors.,"8.0.1, 8.2.0, 8.3.2, 9.1.1, 9.4.0, 10.0.0",aces
Pillow-SIMD,Pillow is the 'friendly PIL fork' by Alex Clark and Contributors. PIL is the Python Imaging Library by Fredrik Lundh and Contributors.,9.2.0,aces
PnetCDF,Parallel netCDF: A Parallel I/O Library for NetCDF File Access,1.12.3,aces
PostgreSQL,"PostgreSQL is a powerful, open source object-relational database system. It is fully ACID compliant, has full support for foreign keys, joins, views, triggers, and stored procedures (in multiple languages). It includes most SQL:2008 data types, including INTEGER, NUMERIC, BOOLEAN, CHAR, VARCHAR, DATE, INTERVAL, and TIMESTAMP. It also supports storage of binary large objects, including pictures, sounds, or video. It has native programming interfaces for C/C++, Java, .Net, Perl, Python, Ruby, Tcl, ODBC, among others, and exceptional documentation.","13.4, 15.2",aces
Ptex,Ptex is a texture mapping system developed by Walt Disney Animation Studios for production-quality rendering.,2.4.2,aces
Puk,PM2 is an umbrella software suite for high-performance runtime systems. Modules may be installed and used together or separately.,20220531,aces
PukABI,PM2 is an umbrella software suite for high-performance runtime systems. Modules may be installed and used together or separately.,20220531,aces
PyCUDA,PyCUDA lets you access Nvidia’s CUDA parallel computation API from Python.,2022.2.2-CUDA-11.8.0,aces
PyCairo,Python bindings for the cairo library,1.21.0,aces
PyFR,PyFR 2.0.0 is an open-source flow solver that uses the high-order flux reconstruction method.,"1.15.0-Python-3.11.5-CUDA-11.8.0, 2.0.0",aces
PyGObject,"PyGObject is a Python package which provides bindings for GObject based libraries such as GTK, GStreamer, WebKitGTK, GLib, GIO and many more.",3.42.1,aces
PyOpenGL,PyOpenGL is the most common cross platform Python binding to OpenGL and related APIs.,"3.1.6, 3.1.7",aces
PyQt5,"PyQt5 is a set of Python bindings for v5 of the Qt application framework from The Qt Company. This bundle includes PyQtWebEngine, a set of Python bindings for The Qt Company’s Qt WebEngine framework.",5.15.4,aces
PyTensor,Optimizing compiler for evaluating mathematical expressions on CPUs and GPUs,2.17.1,aces
PyTorch,Tensors and Dynamic neural networks in Python with strong GPU acceleration. PyTorch is a deep learning framework that puts Python first.,"1.10.0-CUDA-11.3.1, 1.12.0-CUDA-11.7.0, 1.12.0, 1.12.1-CUDA-11.3.1, 1.12.1-CUDA-11.7.0, 1.13.1-CUDA-11.7.0, ...",aces
PyTorch-Geometric,PyTorch Geometric (PyG) is a geometric deep learning extension library for PyTorch.,2.1.0-PyTorch-1.12.0-CUDA-11.7.0,aces
PyTorch-Lightning,PyTorch Lightning is the lightweight PyTorch wrapper for ML researchers.,"1.7.7-CUDA-11.7.0, 1.8.4",aces
PyYAML,PyYAML is a YAML parser and emitter for the Python programming language.,"5.3.1, 5.4.1, 6.0",aces
PyZMQ,Python bindings for ZeroMQ,25.1.1,aces
Pysam,Pysam is a python module for reading and manipulating Samfiles. It's a lightweight wrapper of the samtools C-API. Pysam also includes an interface for tabix.,"0.19.1, 0.20.0",aces
Python,Python is a programming language that lets you work more quickly and integrate your systems more effectively.,"2.7.18-bare, 2.7.18, 3.8.6, 3.9.5-bare, 3.9.5, 3.9.6-bare, 3.9.6, 3.10.4-bare, 3.10.4, ...",aces
QCA,"Taking a hint from the similarly-named Java Cryptography Architecture, QCA aims to provide a straightforward and cross-platform crypto API, using Qt datatypes and conventions. QCA separates the API from the implementation, using plugins known as Providers. The advantage of this model is to allow applications to avoid linking to or explicitly depending on any particular cryptographic library. This allows one to easily change or upgrade crypto implementations without even needing to recompile the application! QCA should work everywhere Qt does, including Windows/Unix/MacOSX.",2.3.5,aces
QGIS,QGIS is a user friendly Open Source Geographic Information System (GIS),3.28.1,aces
QIIME2,QIIME is an open-source bioinformatics pipeline for performing microbiome analysis from raw DNA sequencing data.,2022.11,aces
QJson,QJson is a Qt-based library that maps JSON data to QVariant objects and vice versa.,0.9.0,aces
QScintilla,QScintilla is a port to Qt of Neil Hodgson's Scintilla C++ editor control,2.11.6,aces
Qhull,"Qhull computes the convex hull, Delaunay triangulation, Voronoi diagram, halfspace intersection about a point, furthest-site Delaunay triangulation, and furthest-site Voronoi diagram. The source code runs in 2-d, 3-d, 4-d, and higher dimensions. Qhull implements the Quickhull algorithm for computing the convex hull.",2020.2,aces
Qt5,Qt is a comprehensive cross-platform C++ application framework.,"5.15.2, 5.15.5, 5.15.7, 5.15.10",aces
Qt5Webkit,Qt Port of WebKit. WebKit is an open source web browser engine.,5.212.0-alpha4,aces
QtKeychain,Platform-independent Qt API for storing passwords securely.,0.13.2,aces
QuantumESPRESSO,"Quantum ESPRESSO is an integrated suite of computer codes for electronic-structure calculations and materials modeling at the nanoscale. It is based on density-functional theory, plane waves, and pseudopotentials (both norm-conserving and ultrasoft).","7.1, 7.2",aces
Qwt,The Qwt library contains GUI Components and utility classes which are primarily useful for programs with a technical background.,6.2.0,aces
RAPIDS,"Built based on the Apache Arrow columnar memory format, cuDF is a GPU DataFrame library for loading, joining, aggregating, filtering, and otherwise manipulating data.",23.08,aces
RDFlib,"RDFLib is a Python library for working with RDF, a simple yet powerful language for representing information.","5.0.0, 6.2.0",aces
RDKit,RDKit is a collection of cheminformatics and machine-learning software written in C++ and Python.,2022.09.4,aces
ROOT,The ROOT system provides a set of OO frameworks with all the functionality needed to handle and analyze large amounts of data in a very efficient way.,"6.26.06, 6.26.10",aces
R_tamu,,4.2.2,aces
RapidJSON,A fast JSON parser/generator for C++ with both SAX/DOM style API,"1.1.0, 1.1.0-20230928",aces
Ray-project,Ray is a fast and simple framework for building and running distributed applications.,"2.2.0, 2.6.2",aces
ReFrame,ReFrame is a framework for writing regression tests for HPC systems.,4.0.5,aces
Redis,"Redis is an open source (BSD licensed), in-memory data structure store, used as a database, cache, and message broker. Redis provides data structures such as strings, hashes, lists, sets, sorted sets with range queries, bitmaps, hyperloglogs, geospatial indexes, and streams. Redis has built-in replication, Lua scripting, LRU eviction, transactions, and different levels of on-disk persistence, and provides high availability via Redis Sentinel and automatic partitioning with Redis Cluster.",7.0.8,aces
Ruby,"Ruby is a dynamic, open source programming language with a focus on simplicity and productivity. It has an elegant syntax that is natural to read and easy to write.","3.0.1, 3.0.3",aces
Rust,"Rust is a systems programming language that runs blazingly fast, prevents segfaults, and guarantees thread safety.","1.52.1, 1.54.0, 1.60.0, 1.65.0, 1.70.0, 1.73.0, 1.75.0",aces
SAMtools,"SAM Tools provide various utilities for manipulating alignments in the SAM format, including sorting, merging, indexing and generating alignments in a per-position format.","1.14, 1.16.1, 1.17",aces
SCOTCH,"Software package and libraries for sequential and parallel graph partitioning, static mapping, and sparse matrix block ordering, and sequential mesh and hypergraph partitioning.","6.1.2, 7.0.1, 7.0.3",aces
SCons,SCons is a software construction tool.,4.4.0,aces
SDL2,"SDL: Simple DirectMedia Layer, a cross-platform multimedia library","2.0.20, 2.0.22, 2.26.3, 2.28.2",aces
SHAP,SHAP (SHapley Additive exPlanations) is a game theoretic approach to explain the output of any machine learning model. It connects optimal credit allocation with local explanations using the classic Shapley values from game theory and their related extensions.,0.41.0,aces
SIONlib,"SIONlib is a scalable I/O library for parallel access to task-local files. The library not only supports writing and reading binary data to or from several thousands of processors into a single or a small number of physical files, but also provides global open and close functions to access SIONlib files in parallel. This package provides a stripped-down installation of SIONlib for use with performance tools (e.g., Score-P), with renamed symbols to avoid conflicts when an application using SIONlib itself is linked against a tool requiring a different SIONlib version.","1.7.7-tools, 1.7.7",aces
SLEPc,"SLEPc (Scalable Library for Eigenvalue Problem Computations) is a software library for the solution of large scale sparse eigenvalue problems on parallel computers. It is an extension of PETSc and can be used for either standard or generalized eigenproblems, with real or complex arithmetic. It can also be used for computing a partial SVD of a large, sparse, rectangular matrix, and to solve quadratic eigenvalue problems.",3.17.2,aces
SPAdes,Genome assembler for single-cell and isolates data sets,3.15.5,aces
SQLite,SQLite: SQL Database Engine in a C Library,"3.33.0, 3.35.4, 3.36, 3.38.3, 3.39.4, 3.42.0, 3.43.1, 3.44.0",aces
SRA-Toolkit,"The SRA Toolkit, and the source-code SRA System Development Kit (SDK), will allow you to programmatically access data housed within SRA and convert it from the SRA format",3.0.3,aces
STAR,STAR aligns RNA-seq reads to a reference genome using uncompressed suffix arrays.,2.7.2b,aces
SUNDIALS,SUNDIALS: SUite of Nonlinear and DIfferential/ALgebraic Equation Solvers,6.3.0,aces
SWIG,SWIG is a software development tool that connects programs written in C and C++ with a variety of high-level programming languages.,"4.0.2, 4.1.1",aces
ScaFaCoS,ScaFaCoS is a library of scalable fast coulomb solvers.,"1.0.1, 1.0.4",aces
ScaLAPACK,The ScaLAPACK (or Scalable LAPACK) library includes a subset of LAPACK routines redesigned for distributed memory MIMD parallel computers.,"2.1.0-fb, 2.1.0, 2.2.0-fb",aces
Scalasca,Scalasca is a software tool that supports the performance optimization of parallel programs by measuring and analyzing their runtime behavior. The analysis identifies potential performance bottlenecks -- in particular those concerning communication and synchronization -- and offers guidance in exploring their causes.,2.6.1,aces
SciPy-bundle,Bundle of Python packages for scientific software,"2020.11, 2021.05, 2021.10, 2022.05, 2023.02, 2023.07, ...",aces
Score-P,"The Score-P measurement infrastructure is a highly scalable and easy-to-use tool suite for profiling, event tracing, and online analysis of HPC applications.",8.3,aces
SentencePiece,Unsupervised text tokenizer for Neural Network-based text generation.,0.1.97,aces
Serf,The serf library is a high performance C-based HTTP client library built upon the Apache Portable Runtime (APR) library,1.3.9,aces
Shapely,Shapely is a BSD-licensed Python package for manipulation and analysis of planar geometric objects. It is based on the widely deployed GEOS (the engine of PostGIS) and JTS (from which GEOS is ported) libraries.,"1.8.2, 2.0.1",aces
StarPU,PM2 is an umbrella software suite for high-performance runtime systems. Modules may be installed and used together or separately.,1.3.11,aces
Subversion,Subversion is an open source version control system.,1.14.2,aces
SuiteSparse,SuiteSparse is a collection of libraries manipulate sparse matrices.,5.13.0-METIS-5.1.0,aces
SuperLU_DIST,"SuperLU is a general purpose library for the direct solution of large, sparse, nonsymmetric systems of linear equations on high performance machines.","8.1.0, 8.1.2",aces
Szip,"Szip compression software, providing lossless compression of scientific data",2.1.1,aces
Tcl,"Tcl (Tool Command Language) is a very powerful but easy to learn dynamic programming language, suitable for a very wide range of uses, including web and desktop applications, networking, administration, testing and many more.","8.6.10, 8.6.11, 8.6.12, 8.6.13",aces
TensorFlow,An open-source software library for Machine Intelligence,"2.5.0, 2.5.3-CUDA-11.3.1, 2.6.0-CUDA-11.3.1, 2.7.1-CUDA-11.4.1, 2.8.4, ...",aces
TensorRT,"An SDK for high-performance deep learning inference, includes a deep learning inference optimizer and runtime that delivers low latency and high throughput for inference applications.","8.6.0.12-CUDA-11, 8.6.0.12-CUDA-12, 8.6.1.6-CUDA-11, 8.6.1.6-CUDA-12",aces
Theano,"Theano is a Python library that allows you to define, optimize, and evaluate mathematical expressions involving multi-dimensional arrays efficiently.",1.1.2-PyMC,aces
Tk,"Tk is an open source, cross-platform widget toolchain that provides a library of basic elements for building a graphical user interface (GUI) in many different programming languages.","8.6.10, 8.6.11, 8.6.12, 8.6.13",aces
Tkinter,"Tkinter module, built with the Python buildsystem","3.8.6, 3.9.6, 3.10.4, 3.10.8, 3.11.3",aces
Trilinos,"The Trilinos Project is an effort to develop algorithms and enabling technologies within an object-oriented software framework for the solution of large-scale, complex multi-physics engineering and scientific problems. A unique design feature of Trilinos is its focus on packages.",13.4.1,aces
Trim_Galore,"Trim Galore! is a wrapper script to automate quality and adapter trimming as well as quality control, with some added functionality to remove biased methylation positions for RRBS sequence files (for directional, non-directional (or paired-end) sequencing).",0.6.10,aces
Twisted,"Twisted is an event-based framework for internet applications, supporting Python 3.6+.",22.4.0,aces
UCC,"UCC (Unified Collective Communication) is a collective communication operations API and library that is flexible, complete, and feature-rich for current and emerging programming models and runtimes.","1.0.0, 1.1.0, 1.2.0",aces
UCC-CUDA,"UCC (Unified Collective Communication) is a collective communication operations API and library that is flexible, complete, and feature-rich for current and emerging programming models and runtimes. This module adds the UCC CUDA support.","1.0.0-CUDA-11.7.0, 1.1.0-CUDA-12.0.0",aces
UCX,Unified Communication X An open-source production grade communication framework for data centric and high-performance applications,"1.9.0-CUDA-11.1.1, 1.9.0, 1.10.0, 1.11.2, 1.12.1, 1.13.1, 1.14.0, 1.14.1, 1.15.0-rc4, 1.15.0",aces
UCX-CUDA,Unified Communication X An open-source production grade communication framework for data centric and high-performance applications This module adds the UCX CUDA support.,"1.10.0-CUDA-11.3.1, 1.11.2-CUDA-11.4.1, 1.12.1-CUDA-11.7.0, 1.12.1-CUDA-11.8.0, 1.12.1-CUDA-12.2.0, ...",aces
UDUNITS,"UDUNITS supports conversion of unit specifications between formatted and binary forms, arithmetic manipulation of units, and conversion of values between compatible scales of measurement.","2.2.26, 2.2.28",aces
UnZip,"UnZip is an extraction utility for archives compressed in .zip format (also called ""zipfiles""). Although highly compatible both with PKWARE's PKZIP and PKUNZIP utilities for MS-DOS and with Info-ZIP's own Zip program, our primary objectives have been portability and non-MSDOS functionality.",6.0,aces
VESTA,"VESTA is a 3D visualization program for structured models, volumetric data such as electron/nuclear densities, and crystal morphologies.",3.5.8-gtk3,aces
VMD,"VMD is a molecular visualization program for displaying, animating, and analyzing large biomolecular systems using 3-D graphics and built-in scripting.",1.9.4a57,aces
VSCode,"Visual Studio Code is a lightweight but powerful source code editor which runs on your desktop and is available for Windows, macOS and Linux. It comes with built-in support for JavaScript, TypeScript and Node.js and has a rich ecosystem of extensions for other languages and runtimes (such as C++, C#, Java, Python, PHP, Go, .NET). Begin your journey with VS Code with these introductory videos.",1.85.0,aces
VTK,"The Visualization Toolkit (VTK) is an open-source, freely available software system for 3D computer graphics, image processing and visualization. VTK consists of a C++ class library and several interpreted interface layers including Tcl/Tk, Java, and Python. VTK supports a wide variety of visualization algorithms including: scalar, vector, tensor, texture, and volumetric methods; and advanced modeling techniques such as: implicit modeling, polygon reduction, mesh smoothing, cutting, contouring, and Delaunay triangulation.","9.0.1, 9.1.0, 9.2.2, 9.2.6, 9.3.0",aces
VTune,"Intel VTune Amplifier XE is the premier performance profiler for C, C++, C#, Fortran, Assembly and Java.",2022.3.0,aces
Valgrind,"Valgrind: Debugging and profiling tools  Voro++: Voro++/0.4.6 Voro++ is a software library for carrying out three-dimensional computations of the Voronoi tessellation. A distinguishing feature of the Voro++ library is that it carries out cell-based calculations, computing the Voronoi cell for each particle individually. It is particularly well-suited for applications that rely on cell-based statistics, where features of Voronoi cells (eg. volume, centroid, number of faces) can be used to analyze a system of particles.",3.21.0,aces
VulkanSDK,"The Khronos Vulkan API is an explicit, low-overhead, cross-platform graphics and compute API.",1.3.239.0,aces
WRF,The Weather Research and Forecasting (WRF) Model is a next-generation mesoscale numerical weather prediction system designed to serve both operational forecasting and atmospheric research needs.,"4.4-dmpar, 4.4.1-dmpar",aces
Wayland,"Wayland is a project to define a protocol for a compositor to talk to its clients as well as a library implementation of the protocol. The compositor can be a standalone display server running on Linux kernel modesetting and evdev input devices, an X application, or a wayland client itself. The clients can be traditional applications, X servers (rootless or fullscreen) or other display servers.","1.20.0, 1.21.0, 1.22.0",aces
