software,software_description,software_versions,resource
Geant4,"Geant4 is a toolkit for the simulation of the passage of particles through matter. Its areas of application include high energy, nuclear and accelerator physics, as well as studies in medical and space science.",11.1.2,aces
Geant4-data,Datasets for Geant4.,11.1,aces
GenerativeModels,,0.2.1-CUDA-11.7.0,aces
Ghostscript,"Ghostscript is a versatile processor for PostScript data with the ability to render PostScript to different targets. It used to be part of the cups printing stack, but is no longer used for that.","9.54.0, 9.56.1, 10.0.0, 10.01.2",aces
GlobalArrays,Global Arrays (GA) is a Partitioned Global Address Space (PGAS) programming model,5.8.2,aces
Globus-CLI,"A Command Line Wrapper over the Globus SDK for Python, which provides an interface to Globus services from the shell, and is suited to both interactive and simple scripting use cases.",3.6.0,aces
GnuTLS,"GnuTLS is a secure communications library implementing the SSL, TLS and DTLS protocols and technologies around them. It provides a simple C language application programming interface (API) to access the secure communications protocols as well as APIs to parse and write X.509, PKCS #12, OpenPGP and other required structures. It is aimed to be portable and efficient with focus on security and interoperability.",3.7.3,aces
Go,"Go is an open source programming language that makes it easy to build simple, reliable, and efficient software.",1.18.3,aces
GraphBLAS,"SuiteSparse:GraphBLAS is a complete implementation of the GraphBLAS standard, which defines a set of sparse matrix operations on an extended algebra of semirings using an almost unlimited variety of operators and types. When applied to sparse adjacency matrices, these algebraic operations are equivalent to computations on graphs.",8.2.1,aces
Graphene,Graphene is a thin layer of types for graphic libraries,1.10.8,aces
GraphicsMagick,GraphicsMagick is the swiss army knife of image processing.,1.3.36,aces
Graphviz,"Graphviz is open source graph visualization software. Graph visualization is a way of representing structural information as diagrams of abstract graphs and networks. It has important applications in networking, bioinformatics, software engineering, database and web design, machine learning, and in visual interfaces for other technical domains.",5.0.0,aces
Greenlet,"The greenlet package is a spin-off of Stackless, a version of CPython that supports micro-threads called ""tasklets"". Tasklets run pseudo-concurrently (typically in a single or a few OS-level threads) and are synchronized with data exchanges on ""channels"". A ""greenlet"", on the other hand, is a still more primitive notion of micro-thread with no implicit scheduling; coroutines, in other words. This is useful when you want to control exactly when your code runs.",2.0.2,aces
Guile,"Guile is a programming language, designed to help programmers create flexible applications that can be extended by users or other programmers with plug-ins, modules, or scripts.",3.0.7,aces
HDF,HDF (also known as HDF4) is a library and multi-object file format for storing and managing data between machines.,"4.2.15, 4.2.16-2",aces
HDF-EOS,"HDF-EOS libraries are software libraries built on HDF libraries. It supports three data structures for remote sensing data: Grid, Point and Swath.",2.20,aces
HDF-EOS5,"HDF-EOS libraries are software libraries built on HDF libraries. It supports three data structures for remote sensing data: Grid, Point and Swath.",1.16,aces
HDF5,"HDF5 is a data model, library, and file format for storing and managing data. It supports an unlimited variety of datatypes, and is designed for flexible and efficient I/O and for high volume and complex data.","1.10.7, 1.12.1, 1.12.2, 1.14.0, 1.14.2, 1.14.3",aces
HH-suite,The HH-suite is an open-source software package for sensitive protein sequence searching based on the pairwise alignment of hidden Markov models (HMMs).,3.3.0,aces
HISAT2,HISAT2 is a fast and sensitive alignment program for mapping next-generation sequencing reads (both DNA and RNA) against the general human population (as well as against a single reference genome).,2.2.1,aces
HMMER,"HMMER is used for searching sequence databases for homologs of protein sequences, and for making protein sequence alignments. It implements methods using probabilistic models called profile hidden Markov models (profile HMMs). Compared to BLAST, FASTA, and other sequence alignment and database search tools based on older scoring methodology, HMMER aims to be significantly more accurate and more able to detect remote homologs because of the strength of its underlying mathematical models. In the past, this strength came at significant computational expense, but in the new HMMER3 project, HMMER is now essentially as fast as BLAST.",3.3.2,aces
HPC-X,"NVIDIA HPC-X is a comprehensive software package that includes Message Passing Interface (MPI), Symmetrical Hierarchical Memory (SHMEM) and Partitioned Global Address Space (PGAS) communications libraries, and various acceleration packages.",2.14,aces
HPRC_utils,HPRC_utils is a collection of useful utilities to accompany software modules on the TAMU HPRC clusters.,1.0,aces
HTSeq,HTSeq is a Python library to facilitate processing and analysis of data from high-throughput sequencing (HTS) experiments.,2.0.2,aces
HTSlib,A C library for reading/writing high-throughput sequencing data. This package includes the utilities bgzip and tabix,1.15.1,aces
HarfBuzz,HarfBuzz is an OpenType text shaping engine.,"2.8.1, 2.8.2, 4.2.1, 5.3.1",aces
Highway,"Highway is a C++ library for SIMD (Single Instruction, Multiple Data), i.e. applying the same operation to 'lanes'.","1.0.3, 1.0.4",aces
Horovod,Horovod is a distributed training framework for TensorFlow.,"0.22.1-CUDA-11.3.1-TensorFlow-2.6.0, 0.28.1-CUDA-11.7.0-TensorFlow-2.11.0, 0.28.1-CUDA-11.7.0-PyTorch-1.12.1",aces
Hyperopt,"hyperopt is a Python library for optimizing over awkward search spaces with real-valued, discrete, and conditional dimensions.",0.2.7,aces
Hypre,"Hypre is a library for solving large, sparse linear systems of equations on massively parallel computers. The problems of interest arise in the simulation codes being developed at LLNL and elsewhere to study physical phenomena in the defense, environmental, energy, and biological sciences.","2.25.0, 2.27.0, 2.31.0",aces
ICU,"ICU is a mature, widely used set of C/C++ and Java libraries providing Unicode and Globalization support for software applications.","67.1, 69.1, 71.1, 72.1, 73.2",aces
IML,IML is a free library of C source code which implements algorithms for computing exact solutions to dense systems of linear equations over the integers.,1.0.5,aces
IPython,"IPython provides a rich architecture for interactive computing with: Powerful interactive shells (terminal and Qt-based). A browser-based notebook with support for code, text, mathematical expressions, inline plots and other rich media. Support for interactive data visualization and use of GUI toolkits. Flexible, embeddable interpreters to load into your own projects. Easy to use, high performance tools for parallel computing.","7.26.0, 8.5.0, 8.14.0",aces
ISA-L,Intelligent Storage Acceleration Library,2.30.0,aces
ISL,isl is a library for manipulating sets and relations of integer points bounded by linear constraints.,0.26,aces
ITK,Insight Segmentation and Registration Toolkit (ITK) provides an extensive suite of software tools for registering and segmenting multidimensional imaging data.,5.2.1,aces
IgProf,IgProf is a simple nice tool for measuring and analysing application memory and performance characteristics.,5.9.18,aces
ImageJ,Image Processing and Analysis in Java,1.53t-Java-11,aces
ImageMagick,"ImageMagick is a software suite to create, edit, compose, or convert bitmap images","7.0.11-14, 7.1.0-4, 7.1.0-37, 7.1.0-53, 7.1.1-15",aces
Imath,"Imath is a C++ and python library of 2D and 3D vector, matrix, and math operations for computer graphics","3.1.5, 3.1.6, 3.1.7",aces
Jansson,"Jansson is a C library for encoding, decoding and manipulating JSON data. Its main features and design principles are: * Simple and intuitive API and data model * Comprehensive documentation * No dependencies on other libraries * Full Unicode support (UTF-8) * Extensive test suite",2.13.1,aces
JasPer,The JasPer Project is an open-source initiative to provide a free software-based reference implementation of the codec specified in the JPEG-2000 Part-1 standard.,"2.0.24, 2.0.28, 2.0.33, 4.0.0",aces
Java,"Java Platform, Standard Edition (Java SE) lets you develop and deploy Java applications on desktops and servers.","1.8.0_371, 11.0.16, 11.0.18, 17.0.6",aces
Jmol,"Jmol: an open-source Java viewer for chemical structures in 3D with features for chemicals, crystals, materials and biomolecules","16.1.59-Java-1.8.0_371, 16.1.59",aces
JsonCpp,"JsonCpp is a C++ library that allows manipulating JSON values, including serialization and deserialization to and from strings. It can also preserve existing comment in unserialization/serialization steps, making it a convenient format to store user input files.","1.9.4, 1.9.5",aces
Julia,"Julia is a high-level, high-performance dynamic programming language for numerical computing","1.8.5-linux-x86_64, 1.9.3-linux-x86_64, 1.10.0-musl-x86_64, 1.10.2-linux-x86_64",aces
JupyterLab,"JupyterLab is the next-generation user interface for Project Jupyter offering all the familiar building blocks of the classic Jupyter Notebook (notebook, terminal, text editor, file browser, rich outputs, etc.) in a flexible and powerful user interface. JupyterLab will eventually replace the classic Jupyter Notebook.",4.0.3,aces
JupyterNotebook,"The Jupyter Notebook is the original web application for creating and sharing computational documents. It offers a simple, streamlined, document-centric experience.",7.0.3,aces
KaHIP,The graph partitioning framework KaHIP -- Karlsruhe High Quality Partitioning.,"3.14, 3.16",aces
Kalign,Kalign is a fast multiple sequence alignment program for biological sequences.,"3.3.1, 3.3.5, 3.4.0",aces
Keras,"Keras is a deep learning API written in Python, running on top of the machine learning platform TensorFlow.",2.4.3-TensorFlow-2.5.0,aces
Kraken2,"Kraken is a system for assigning taxonomic labels to short DNA sequences, usually obtained through metagenomic studies. Previous attempts by other bioinformatics software to accomplish this task have often used sequence alignment or machine learning techniques that were quite slow, leading to the development of less sensitive but much faster abundance estimation programs. Kraken aims to achieve high sensitivity and high speed by utilizing exact alignments of k-mers and a novel classification algorithm.",2.1.2,aces
LAME,LAME is a high quality MPEG Audio Layer III (MP3) encoder licensed under the LGPL.,3.100,aces
LAMMPS,"LAMMPS is a classical molecular dynamics code, and an acronym for Large-scale Atomic/Molecular Massively Parallel Simulator. LAMMPS has potentials for solid-state materials (metals, semiconductors) and soft matter (biomolecules, polymers) and coarse-grained or mesoscopic systems. It can be used to model atoms or, more generically, as a parallel particle simulator at the atomic, meso, or continuum scale. LAMMPS runs on single processors or in parallel using message-passing techniques and a spatial-decomposition of the simulation domain. The code is designed to be easy to modify or extend with new functionality.","2Aug2023_update2-CUDA-11.8.0-sm90, 2Aug2023_update2-intel-2023.07, 3Aug2023-intel-2023.07, 23Jun2022_update4-kokkos-CUDA-11.4.1, ...",aces
LASSO-Python,This python library is designed for general purpose usage in the field of Computer Aided Engineering (CAE). It's name originates from the original initiator and donator of the project Lasso GmbH. The library is now maintained by an open-source community.,2.0.0,aces
LERC,"LERC is an open-source image or raster format which supports rapid encoding and decoding for any pixel type (not just RGB or Byte). Users set the maximum compression error per pixel while encoding, so the precision of the original input image is preserved (within user defined error bounds).",4.0.0,aces
LLVM,"The LLVM Core libraries provide a modern source- and target-independent optimizer, along with code generation support for many popular CPUs (as well as some less common ones!) These libraries are built around a well specified code representation known as the LLVM intermediate representation (""LLVM IR""). The LLVM Core libraries are well documented, and it is particularly easy to invent your own language (or port an existing compiler) to use LLVM as an optimizer and code generator.","10.0.1, 11.1.0, 12.0.1, 13.0.1, 14.0.3, 14.0.6-llvmlite, 14.0.6, 15.0.5, 16.0.6",aces
LMDB,"LMDB is a fast, memory-efficient database. With memory-mapped files, it has the read performance of a pure in-memory database while retaining the persistence of standard disk-based databases.","0.9.24, 0.9.28, 0.9.29, 0.9.31",aces
Leptonica,Leptonica is a collection of pedagogically-oriented open source software that is broadly useful for image processing and image analysis applications.,1.83.0,aces
LevelDB,LevelDB is a fast key-value storage library written at Google that provides an ordered mapping from string keys to string values.,1.22,aces
LibSoup,"libsoup is an HTTP client/server library for GNOME. It uses GObjects and the glib main loop, to integrate well with GNOME applications, and also has a synchronous API, for use in threaded applications.",3.0.7,aces
LibTIFF,tiff: Library and tools for reading and writing TIFF data files,"4.1.0, 4.2.0, 4.3.0, 4.4.0, 4.5.0",aces
Libint,Libint library is used to evaluate the traditional (electron repulsion) and certain novel two-body matrix elements (integrals) over Cartesian Gaussian functions used in modern atomic and molecular theory.,2.7.2-lmax-6-cp2k,aces
LittleCMS,"Little CMS intends to be an OPEN SOURCE small-footprint color management engine, with special focus on accuracy and performance.","2.12, 2.13.1, 2.14, 2.15",aces
Lua,"Lua is a powerful, fast, lightweight, embeddable scripting language. Lua combines simple procedural syntax with powerful data description constructs based on associative arrays and extensible semantics. Lua is dynamically typed, runs by interpreting bytecode for a register-based virtual machine, and has automatic memory management with incremental garbage collection, making it ideal for configuration, scripting, and rapid prototyping.","5.4.4, 5.4.6",aces
M4,"GNU M4 is an implementation of the traditional Unix macro processor. It is mostly SVR4 compatible although it has some extensions (for example, handling more than 9 positional parameters to macros). GNU M4 also has built-in functions for including files, running shell commands, doing arithmetic, etc.","1.4.18, 1.4.19",aces
MAFFT,"MAFFT is a multiple sequence alignment program for unix-like operating systems. It offers a range of multiple alignment methods, L-INS-i (accurate; for alignment of <∼200 sequences), FFT-NS-2 (fast; for alignment of <∼30,000 sequences), etc.",7.520-with-extensions,aces
MATIO,matio is an C library for reading and writing Matlab MAT files.,1.5.23,aces
METIS,"METIS is a set of serial programs for partitioning graphs, partitioning finite element meshes, and producing fill reducing orderings for sparse matrices. The algorithms implemented in METIS are based on the multilevel recursive-bisection, multilevel k-way, and multi-constraint partitioning schemes.",5.1.0,aces
MFEM,MFEM is a modular parallel C++ library for finite element methods. MFEM can be viewed as a finite element toolbox that provides the building blocks for developing finite element algorithms in a manner similar to that of MATLAB for linear algebra methods.,70941b4,aces
MONAI,"MONAI is a PyTorch-based, open-source framework for deep learning in healthcare imaging, part of PyTorch Ecosystem.",1.0.1,aces
MPC,"Gnu Mpc is a C library for the arithmetic of complex numbers with arbitrarily high precision and correct rounding of the result. It extends the principles of the IEEE-754 standard for fixed precision real floating point numbers to complex numbers, providing well-defined semantics for every operation. At the same time, speed of operation at high precision is a major design goal.","1.2.1, 1.3.1",aces
MPFR,The MPFR library is a C library for multiple-precision floating-point computations with correct rounding.,"4.1.0, 4.2.0, 4.2.1",aces
MUMPS,A parallel sparse direct solver,"5.5.1-metis, 5.6.1-metis",aces
MVAPICH2-GDR,MVAPICH2-GDR 2.3.7 binary release is based on MVAPICH2 2.3.7 and incorporates designs that take advantage of GPUDirect RDMA technology enabling direct P2P communication between NVIDIA GPUs and Mellanox InfiniBand adapters.,2.3.7-GCC-11.2.0-CUDA-11.4.1,aces
Magics,Magics is ECMWF's meteorological plotting software and can be either accessed directly through its Python or Fortran interfaces or by using Metview.,4.13.0,aces
Mako,A super-fast templating language that borrows the best ideas from the existing templating languages,"1.1.3, 1.1.4, 1.2.0, 1.2.4",aces
Mamba,"Mamba is a fast, robust, and cross-platform package manager. It runs on Windows, OS X and Linux (ARM64 and PPC64LE included) and is fully compatible with conda packages and supports most of conda's commands.",23.1.0-4,aces
Maven,"Binary maven install, Apache Maven is a software project management and comprehension tool. Based on the concept of a project object model (POM), Maven can manage a project's build, reporting and documentation from a central piece of information.",3.9.6,aces
MemoryViewer,MemoryViewer software gives system administrators comprehensive insight into the physical memory topology as well as the application memory utilization.,1.0,aces
Mercurial,"Mercurial is a free, distributed source control management tool. It efficiently handles projects of any size and offers an easy and intuitive interface.",6.4.5,aces
Mesa,Mesa is an open-source implementation of the OpenGL specification - a system for rendering interactive 3D graphics.,"21.1.1, 21.1.7, 22.0.3, 22.2.4-LLVM-14.0.6, 22.2.4, 23.1.4",aces
Meson,Meson is a cross-platform build system designed to be both as fast and as user friendly as possible.,"0.55.3, 0.58.0, 0.58.2, 0.62.1, 0.64.0, 1.1.1, 1.2.3",aces
Miniconda3,"Miniconda is a free minimal installer for conda. It is a small, bootstrap version of Anaconda that includes only conda, Python, the packages they depend on, and a small number of other useful packages.","4.12.0, 22.11.1-1, 23.3.1-0, 23.5.2-0, 23.9.0-0",aces
NAMD,NAMD is a parallel molecular dynamics code designed for high-performance simulation of large biomolecular systems.,2.14-mpi,aces
NASM,NASM: General-purpose x86 assembler,"2.15.05, 2.16.01",aces
NCCL,The NVIDIA Collective Communications Library (NCCL) implements multi-GPU and multi-node collective communication primitives that are performance optimized for NVIDIA GPUs.,"2.8.3-CUDA-11.1.1, 2.10.3-CUDA-11.3.1, 2.10.3-CUDA-11.4.1, 2.12.12-CUDA-11.7.0, 2.12.12-CUDA-11.8.0, 2.16.2-CUDA-12.0.0, ...",aces
NCL,NCL is an interpreted language designed specifically for scientific data analysis and visualization.,6.6.2,aces
NCO,"The NCO toolkit manipulates and analyzes data stored in netCDF-accessible formats, including DAP, HDF4, and HDF5.",5.0.1,aces
NEdit,"A fast, compact Motif/X11 plain text editor, for most popular Unix systems.",5.7.7,aces
NLopt,"NLopt is a free/open-source library for nonlinear optimization, providing a common interface for a number of different free optimization routines available online as well as original implementations of various other algorithms.","2.7.0, 2.7.1",aces
NSPR,Netscape Portable Runtime (NSPR) provides a platform-neutral API for system level and libc-like functions.,"4.32, 4.34, 4.35",aces
NSS,Network Security Services (NSS) is a set of libraries designed to support cross-platform development of security-enabled client and server applications.,"3.69, 3.79, 3.85, 3.89.1",aces
NVHPC,"C, C++ and Fortran compilers included with the NVIDIA HPC SDK (previously: PGI)","21.9, 22.9-CUDA-11.7.0, 22.11-CUDA-11.7.0, 22.11-CUDA-11.8.0, 23.1-CUDA-12.0.0, 23.7-CUDA-12.1.1, 23.7-CUDA-12.2.0, ...",aces
NVSHMEM,"NVSHMEM is a parallel programming interface based on OpenSHMEM that provides efficient and scalable communication for NVIDIA GPU clusters. NVSHMEM creates a global address space for data that spans the memory of multiple GPUs and can be accessed with fine-grained GPU-initiated operations, CPU-initiated operations, and operations on CUDA streams.",2.8.0-CUDA-11.7.0,aces
NiBabel,"NiBabel provides read/write access to some common medical and neuroimaging file formats, including: ANALYZE (plain, SPM99, SPM2 and later), GIFTI, NIfTI1, NIfTI2, MINC1, MINC2, MGH and ECAT as well as Philips PAR/REC. We can read and write Freesurfer geometry, and read Freesurfer morphometry and annotation files. There is some very limited support for DICOM. NiBabel is the successor of PyNIfTI.",4.0.2,aces
Ninja,Ninja is a small build system with a focus on speed.,"1.10.1, 1.10.2, 1.11.1",aces
ONNX,"Open Neural Network Exchange (ONNX) is an open ecosystem that empowers AI developers to choose the right tools as their project evolves. ONNX provides an open source format for AI models, both deep learning and traditional ML. It defines an extensible computation graph model, as well as definitions of built-in operators and standard data types. Currently we focus on the capabilities needed for inferencing (scoring).",1.15.0,aces
ONNX-Runtime,"ONNX Runtime inference can enable faster customer experiences and lower costs, supporting models from deep learning frameworks such as PyTorch and TensorFlow/Keras as well as classical machine learning libraries such as scikit-learn, LightGBM, XGBoost, etc. ONNX Runtime is compatible with different hardware, drivers, and operating systems, and provides optimal performance by leveraging hardware accelerators where applicable alongside graph optimizations and transforms.",1.16.3,aces
OPARI2,"OPARI2, the successor of Forschungszentrum Juelich's OPARI, is a source-to-source instrumentation tool for OpenMP and hybrid codes. It surrounds OpenMP directives and runtime library calls with calls to the POMP2 measurement interface.",2.0.7,aces
OpenBLAS,OpenBLAS is an optimized BLAS library based on GotoBLAS2 1.13 BSD version.,"0.3.12, 0.3.15, 0.3.18, 0.3.20, 0.3.21, 0.3.23, 0.3.24",aces
OpenBabel,"Open Babel is a chemical toolbox designed to speak the many languages of chemical data. It's an open, collaborative project allowing anyone to search, convert, analyze, or store data from molecular modeling, chemistry, solid-state materials, biochemistry, or related areas.",3.1.1,aces
OpenCV,OpenCV (Open Source Computer Vision Library) is an open source computer vision and machine learning software library. OpenCV was built to provide a common infrastructure for computer vision applications and to accelerate the use of machine perception in the commercial products. Includes extra modules for OpenCV from the contrib repository.,"4.6.0-contrib, 4.6.0-CUDA-11.7.0-contrib",aces
OpenEXR,OpenEXR is a high dynamic-range (HDR) image file format developed by Industrial Light & Magic for use in computer imaging applications,"3.1.5, 3.1.7",aces
OpenFOAM,"OpenFOAM is a free, open source CFD software package. OpenFOAM has an extensive range of features to solve anything from complex fluid flows involving chemical reactions, turbulence and heat transfer, to solid dynamics and electromagnetics.","v2206, v2312, 10",aces
OpenFold,A faithful PyTorch reproduction of DeepMind's AlphaFold 2,1.0.1-CUDA-11.3.1,aces
OpenImageIO,"OpenImageIO is a library for reading and writing images, and a bunch of related classes, utilities, and applications.",2.3.17.0,aces
OpenJPEG,"OpenJPEG is an open-source JPEG 2000 codec written in C language. It has been developed in order to promote the use of JPEG 2000, a still-image compression standard from the Joint Photographic Experts Group (JPEG). Since may 2015, it is officially recognized by ISO/IEC and ITU-T as a JPEG 2000 Reference Software.","2.4.0, 2.5.0",aces
OpenMM,OpenMM is a toolkit for molecular simulation.,"7.5.1-DeepMind-patch, 7.7.0, 8.0.0-CUDA-11.7.0, 8.0.0-CUDA-11.8.0, 8.0.0",aces
OpenMPI,The Open MPI Project is an open source MPI-3 implementation.,"nostub-4.1.4, 4.0.5, 4.1.1, 4.1.4-CUDA-11.8.0, 4.1.4, 4.1.5, 4.1.6",aces
OpenPGM,"OpenPGM is an open source implementation of the Pragmatic General Multicast (PGM) specification in RFC 3208 available at www.ietf.org. PGM is a reliable and scalable multicast protocol that enables receivers to detect loss, request retransmission of lost data, or notify an application of unrecoverable loss. PGM is a receiver-reliable protocol, which means the receiver is responsible for ensuring all data is received, absolving the sender of reception responsibility.",5.2.122,aces
OpenSSL,"The OpenSSL Project is a collaborative effort to develop a robust, commercial-grade, full-featured, and Open Source toolchain implementing the Secure Sockets Layer (SSL v2/v3) and Transport Layer Security (TLS v1) protocols as well as a full-strength general purpose cryptography library.","1.1, 1.1.1q, 3.1.5",aces
OpenSceneGraph,"The OpenSceneGraph is an open source high performance 3D graphics toolkit, used by application developers in fields such as visual simulation, games, virtual reality, scientific visualization and modelling. Written entirely in Standard C++ and OpenGL it runs on all Windows platforms, OSX, GNU/Linux, IRIX, Solaris, HP-Ux, AIX and FreeBSD operating systems. The OpenSceneGraph is now well established as the world leading scene graph technology, used widely in the vis-sim, space, scientific, oil-gas, games and virtual reality industries.",3.6.5,aces
