software,software_description,software_versions,resource
ACTC,ACTC converts independent triangles into triangle strips or fans.,1.1,aces
ACTC,ACTC converts independent triangles into triangle strips or fans.,1.3,aces
ANTLR,"ANTLR, ANother Tool for Language Recognition, (formerly PCCTS) is a language tool that provides a framework for constructing recognizers, compilers, and translators from grammatical descriptions containing Java, C#, C++, or Python actions.",2.7.7-Java-11,aces
APR,Apache Portable Runtime (APR) libraries.,1.7.0,aces
APR-util,Apache Portable Runtime (APR) util libraries.,1.6.1,aces
ASE,"ASE is a python package providing an open source Atomic Simulation Environment in the Python scripting language. From version 3.20.1 we also include the ase-ext package, it contains optional reimplementations in C of functions in ASE. ASE uses it automatically when installed.","3.20.1, 3.22.1",aces
ATK,"ATK provides the set of accessibility interfaces that are implemented by other toolkits and applications. Using the ATK interfaces, accessibility tools have full access to view and control running applications.","2.36.0, 2.38.0",aces
Abseil,"Abseil is an open-source collection of C++ library code designed to augment the C++ standard library. The Abseil library code is collected from Google's own C++ code base, has been extensively tested and used in production, and is the same code we depend on in our daily coding lives.","20230125.2, 20230125.3, 20230802.1",aces
AlphaFold,AlphaFold can predict protein structures with atomic accuracy even where no similar structure is known,2.3.2-CUDA-11.8.0,aces
AlphaPickle,ALPHAPICKLE is a programme for extracting the outputs of DeepMind's ALPHAFOLD protein prediction algorithm from the pickle (.pkl) file output.,1.4.1,aces
AmberTools,"AmberTools consists of several independently developed packages that work well by themselves, and with Amber itself. The suite can also be used to carry out complete molecular dynamics simulations, with either explicit water or generalized Born solvent models.",22.3,aces
Anaconda3,"Built to complement the rich, open source Python community, the Anaconda platform provides an enterprise-ready data analytics platform that empowers companies to adopt a modern open data science analytics architecture.","2021.11, 2022.05, 2022.10, 2023.03-1, 2023.07-2, 2024.02-1",aces
Armadillo,"Armadillo is an open-source C++ linear algebra library (matrix maths) aiming towards a good balance between speed and ease of use. Integer, floating point and complex numbers are supported, as well as a subset of trigonometric and statistics functions.","11.4.3, 12.6.2",aces
Arrow,"Apache Arrow (incl. PyArrow Python bindings), a cross-language development platform for in-memory data.","8.0.0, 11.0.0",aces
Autoconf,"Autoconf is an extensible package of M4 macros that produce shell scripts to automatically configure software source code packages. These scripts can adapt the packages to many kinds of UNIX-like systems without manual user intervention. Autoconf creates a configuration script for a package from a template file that lists the operating system features that the package can use, in the form of M4 macro calls.","2.69, 2.71",aces
Automake,Automake: GNU Standards-compliant Makefile generator,"1.16.2, 1.16.3, 1.16.4, 1.16.5",aces
Autotools,"This bundle collect the standard GNU build tools: Autoconf, Automake and libtool","20200321, 20210128, 20210726, 20220317",aces
BBMap,"BBMap short read aligner, and other bioinformatic tools.",38.90,aces
BEDTools,"BEDTools: a powerful toolset for genome arithmetic. The BEDTools utilities allow one to address common genomics tasks such as finding feature overlaps and computing coverage. The utilities are largely based on four widely-used file formats: BED, GFF/GTF, VCF, and SAM/BAM.  BLAST+: BLAST+/2.13.0, BLAST+/2.14.1 Basic Local Alignment Search Tool, or BLAST, is an algorithm for comparing primary biological sequence information, such as the amino-acid sequences of different proteins or the nucleotides of DNA sequences.",2.31.0,aces
BLIS,BLIS is a portable software framework for instantiating high-performance BLAS-like dense linear algebra libraries.,"0.8.1, 0.9.0",aces
BWA,Burrows-Wheeler Aligner (BWA) is an efficient program that aligns relatively short nucleotide sequences against a long reference sequence such as the human genome.,0.7.17,aces
BamTools,BamTools provides both a programmer's API and an end-user's toolkit for handling BAM files.,2.5.2,aces
Bazel,Bazel is a build tool that builds code quickly and reliably. It is used to build the majority of Google's software.,"3.7.2, 4.2.2, 5.1.1, 6.3.1",aces
BeautifulSoup,Beautiful Soup is a Python library designed for quick turnaround projects like screen-scraping.,"4.10.0, 4.11.1, 4.12.2",aces
BioPerl,"Bioperl is the product of a community effort to produce Perl code which is useful in biology. Examples include Sequence objects, Alignment objects and database searching objects.",1.7.8,aces
Biopython,Biopython is a set of freely available tools for biological computation written in Python by an international team of developers. It is a distributed collaborative effort to develop Python libraries and applications which address the needs of current and future work in bioinformatics.,"1.79, 1.81, 1.82",aces
Bison,Bison is a general-purpose parser generator that converts an annotated context-free grammar into a deterministic LR or generalized LR (GLR) parser employing LALR(1) parser tables.,"3.3.2, 3.7.1, 3.7.6, 3.8.2",aces
Blender,"Blender is the free and open source 3D creation suite. It supports the entirety of the 3D pipeline-modeling, rigging, animation, simulation, rendering, compositing and motion tracking, even video editing and game creation.",3.5.0-linux-x86_64-CUDA-11.7.0,aces
Blosc2,"Blosc, an extremely fast, multi-threaded, meta-compressor library",2.4.3,aces
Boost,"Boost provides free peer-reviewed portable C++ source libraries.  Boost.MPI: Boost.MPI/1.79.0 Boost provides free peer-reviewed portable C++ source libraries.  Boost.Python: Boost.Python/1.79.0, Boost.Python/1.81.0, Boost.Python/1.83.0 Boost.Python is a C++ library which enables seamless interoperability between C++ and the Python programming language.","1.76.0, 1.77.0, 1.79.0, 1.81.0, 1.82.0, 1.83.0",aces
Brotli,"Brotli is a generic-purpose lossless compression algorithm that compresses data using a combination of a modern variant of the LZ77 algorithm, Huffman coding and 2nd order context modeling, with a compression ratio comparable to the best currently available general-purpose compression methods. It is similar in speed with deflate but offers more dense compression. The specification of the Brotli Compressed Data Format is defined in RFC 7932.",1.0.9,aces
Brotli-python,"Brotli is a generic-purpose lossless compression algorithm that compresses data using a combination of a modern variant of the LZ77 algorithm, Huffman coding and 2nd order context modeling, with a compression ratio comparable to the best currently available general-purpose compression methods. It is similar in speed with deflate but offers more dense compression. The specification of the Brotli Compressed Data Format is defined in RFC 7932.",1.0.9,aces
Brunsli,Brunsli is a lossless JPEG repacking library.,0.1,aces
CD-HIT,CD-HIT is a very widely used program for clustering and comparing protein or nucleotide sequences.,4.8.1,aces
CDO,CDO is a collection of command line Operators to manipulate and analyse Climate and NWP model Data.,2.0.5,aces
CESM-deps,"CESM is a fully-coupled, community, global climate model that provides state-of-the-art computer simulations of the Earth's past, present, and future climate states.",2,aces
CFITSIO,CFITSIO is a library of C and Fortran subroutines for reading and writing data files in FITS (Flexible Image Transport System) data format.,"4.2.0, 4.3.0",aces
CGAL,The goal of the CGAL Open Source Project is to provide easy access to efficient and reliable geometric algorithms in the form of a C++ library.,"4.14.3, 5.6",aces
CGNS,"The CGNS system is designed to facilitate the exchange of data between sites and applications, and to help stabilize the archiving of aerodynamic data.",4.4.0,aces
CLHEP,"The CLHEP project is intended to be a set of HEP-specific foundation and utility classes such as random generators, physics vectors, geometry and linear algebra. CLHEP is structured in a set of packages independent of any external package.",2.4.6.2,aces
CLIP,"CLIP (Contrastive Language-Image Pre-Training) is a neural network trained on a variety of (image, text) pairs. It can be instructed in natural language to predict the most relevant text snippet, given an image, without directly optimizing for the task, similarly to the zero-shot capabilities of GPT-2 and 3.",20230220-CUDA-11.7.0,aces
CMake,"CMake, the cross-platform, open-source build system. CMake is a family of tools designed to build, test and package software.","3.18.4, 3.20.1, 3.21.1, 3.22.1, 3.23.1, 3.24.3, 3.26.3, 3.27.6",aces
CP2K,"CP2K is a freely available (GPL) program, written in Fortran 95, to perform atomistic and molecular simulations of solid state, liquid, molecular and biological systems. It provides a general framework for different methods such as e.g. density functional theory (DFT) using a mixed Gaussian and plane waves approach (GPW), and classical pair and many-body potentials.","9.1-lib, 9.1, 2022.1-lib, 2022.1, 2023.1-CUDA-11.8.0, 2023.1-lib, 2023.1-PLUMED-2.9.0, 2023.1",aces
CUDA,CUDA (formerly Compute Unified Device Architecture) is a parallel computing platform and programming model created by NVIDIA and implemented by the graphics processing units (GPUs) that they produce. CUDA gives developers access to the virtual instruction set and memory of the parallel computational elements in CUDA GPUs.,"11.1.1, 11.3.1, 11.4.1, 11.7.0, 11.8.0, 12.0.0, 12.1.0, 12.1.1, 12.2.0, 12.2.2, 12.3.0, 12.3.2",aces
CUDA-Samples,Samples for CUDA Developers which demonstrates features in CUDA Toolkit,12.1-CUDA-12.1.1,aces
CUDAcore,CUDA (formerly Compute Unified Device Architecture) is a parallel computing platform and programming model created by NVIDIA and implemented by the graphics processing units (GPUs) that they produce. CUDA gives developers access to the virtual instruction set and memory of the parallel computational elements in CUDA GPUs.,11.1.1,aces
CUnit,Automated testing framework for C.,2.1-3,aces
Cartopy,Cartopy is a Python package designed to make drawing maps for data analysis and visualisation easy.,"0.20.3, 0.22.0",aces
Catch2,"Catch2 is mainly a unit testing framework for C++, but it also provides basic micro-benchmarking features, and simple BDD macros.",3.4.0,aces
Chameleon,"Chameleon is a framework written in C which provides routines to solve dense general systems of linear equations, symmetric positive definite systems of linear equations and linear least squares problems, using LU, Cholesky, QR and LQ factorizations.",1.2.0,aces
Check,"Check is a unit testing framework for C. It features a simple interface for defining unit tests, putting little in the way of the developer. Tests are run in a separate address space, so both assertion failures and code errors that cause segmentation faults or other signals can be caught. Test results are reportable in the following: Subunit, TAP, XML, and a generic logging format.",0.15.2,aces
ChimeraX,"UCSF ChimeraX (or simply ChimeraX) is the next-generation molecular visualization program from the Resource for Biocomputing, Visualization, and Informatics (RBVI), following UCSF Chimera.","1.3, 1.6.1, 1.7.1",aces
Clang,"C, C++, Objective-C compiler, based on LLVM. Does not include C++ standard library -- use libstdc++ from GCC.","13.0.1, 15.0.5, 16.0.6",aces
CliMetLab,"CliMetLab is a Python package aiming at simplifying access to climate and meteorological datasets, allowing users to focus on science instead of technical issues such as data access and data formats. It is mostly intended to be used in Jupyter notebooks, and be interoperable with all popular data analytic packages, such as Numpy, Pandas, Xarray, SciPy, Matplotlib, etc. as well as machine learning frameworks, such as Tensorflow, Keras or PyTorch.",0.12.6,aces
ColabFold,Making protein folding accessible to all. Predict proteins structures both in google colab and on your machine.,1.5.2-CUDA-11.7.0,aces
CoordgenLibs,Schrodinger-developed 2D Coordinate Generation,3.0.1,aces
CryoSPARC,CryoSPARC combines powerful innovations in 3D reconstruction algorithms with specially designed software to provide a streamlined end-to-end single particle cryo-EM workflow.,4.2.1,aces
CuPy,CuPy is an open-source array library accelerated with NVIDIA CUDA.,11.4.0-CUDA-11.4.1,aces
CubeGUI,"Cube, which is used as performance report explorer for Scalasca and Score-P, is a generic tool for displaying a multi-dimensional performance space consisting of the dimensions (i) performance metric, (ii) call path, and (iii) system resource. Each dimension can be represented as a tree, where non-leaf nodes of the tree can be collapsed or expanded to achieve the desired level of granularity. This module provides the Cube graphical report explorer.",4.8.2,aces
CubeLib,"Cube, which is used as performance report explorer for Scalasca and Score-P, is a generic tool for displaying a multi-dimensional performance space consisting of the dimensions (i) performance metric, (ii) call path, and (iii) system resource. Each dimension can be represented as a tree, where non-leaf nodes of the tree can be collapsed or expanded to achieve the desired level of granularity. This module provides the Cube general purpose C++ library component and command-line tools.","4.8.1, 4.8.2",aces
CubeWriter,"Cube, which is used as performance report explorer for Scalasca and Score-P, is a generic tool for displaying a multi-dimensional performance space consisting of the dimensions (i) performance metric, (ii) call path, and (iii) system resource. Each dimension can be represented as a tree, where non-leaf nodes of the tree can be collapsed or expanded to achieve the desired level of granularity. This module provides the Cube high-performance C writer library component.",4.8.2,aces
Cython,Cython is an optimising static compiler for both the Python programming language and the extended Cython programming language (based on Pyrex).,"0.29.33, 3.0.7",aces
DB,"Berkeley DB enables the development of custom data management solutions, without the overhead traditionally associated with such custom projects.",18.1.40,aces
DBCSR,"DBCSR stands for Distributed Blocked Compressed Sparse Row. DBCSR is a library designed to efficiently perform sparse matrix-matrix multiplication, among other operations.","2.5.0, 2.6.0",aces
DBus,"D-Bus is a message bus system, a simple way for applications to talk to one another. In addition to interprocess communication, D-Bus helps coordinate process lifecycle; it makes it simple and reliable to code a ""single instance"" application or daemon, and to launch applications and daemons on demand when their services are needed.","1.13.18, 1.14.0, 1.15.2, 1.15.4",aces
DCMTK,"DCMTK is a collection of libraries and applications implementing large parts the DICOM standard. It includes software for examining, constructing and converting DICOM image files, handling offline media, sending and receiving images over a network connection, as well as demonstrative image storage and worklist servers.",3.6.7,aces
Dorado,"Dorado is a high-performance, easy-to-use, open source basecaller for Oxford Nanopore reads.",0.5.2-CUDA-11.8.0,aces
Doxygen,"Doxygen is a documentation system for C++, C, Java, Objective-C, Python, IDL (Corba and Microsoft flavors), Fortran, VHDL, PHP, C#, and to some extent D.","1.8.20, 1.9.1, 1.9.4, 1.9.5, 1.9.7, 1.9.8",aces
Draco,Draco is a library for compressing and decompressing 3D geometric meshes and point clouds. It is intended to improve the storage and transmission of 3D graphics.,1.5.6,aces
ELPA,Eigenvalue SoLvers for Petaflop-Applications.,"2021.11.001, 2022.05.001-CUDA-11.8.0, 2022.05.001, 2023.05.001",aces
ESMF,"The Earth System Modeling Framework (ESMF) is a suite of software tools for developing high-performance, multi-component Earth science modeling applications.","8.0.1, 8.1.1, 8.3.0",aces
EasyBuild,"EasyBuild is a software build and installation framework written in Python that allows you to install software in a structured, repeatable and robust way.","4.7.1, 4.8.0, 4.8.2, 4.9.0",aces
EasyBuild-aces,EasyBuild environment variables for building system software in /tmp and installing in /sw/eb on aces.hprc.tamu.edu,0,aces
Eigen,"Eigen is a C++ template library for linear algebra: matrices, vectors, numerical solvers, and related algorithms.","3.3.8, 3.3.9, 3.4.0",aces
Emacs,"GNU Emacs is an extensible, customizable text editor--and more. At its core is an interpreter for Emacs Lisp, a dialect of the Lisp programming language with extensions to support text editing.","27.2, 28.2",aces
FFTW,"FFTW is a C subroutine library for computing the discrete Fourier transform (DFT) in one or more dimensions, of arbitrary input size, and of both real and complex data.  FFTW.MPI: FFTW.MPI/3.3.10 FFTW is a C subroutine library for computing the discrete Fourier transform (DFT) in one or more dimensions, of arbitrary input size, and of both real and complex data.","3.3.8, 3.3.9, 3.3.10",aces
FFmpeg,"A complete, cross-platform solution to record, convert and stream audio and video.","4.3.2, 4.4.2, 5.1.2, 6.0",aces
FLAC,"FLAC stands for Free Lossless Audio Codec, an audio format similar to MP3, but lossless, meaning that audio is compressed in FLAC without any loss in quality.","1.3.3, 1.3.4, 1.4.2",aces
FLTK,"FLTK is a cross-platform C++ GUI toolkit for UNIX/Linux (X11), Microsoft Windows, and MacOS X. FLTK provides modern GUI functionality without the bloat and supports 3D graphics via OpenGL and its built-in GLUT emulation.",1.3.8,aces
FastQC,"FastQC is a quality control application for high throughput sequence data. It reads in sequence data in a variety of formats and can either provide an interactive application to review the results of several different QC checks, or create an HTML based report which can be integrated into a pipeline.",0.11.9-Java-11,aces
FastTree,FastTree infers approximately-maximum-likelihood phylogenetic trees from alignments of nucleotide or protein sequences. FastTree can handle alignments with up to a million of sequences in a reasonable amount of time and memory.,2.1.11,aces
Fiona,"Fiona is designed to be simple and dependable. It focuses on reading and writing data in standard Python IO style and relies upon familiar Python types and protocols such as files, dictionaries, mappings, and iterators instead of classes specific to OGR. Fiona can read and write real-world data using multi-layered GIS formats and zipped virtual file systems and integrates readily with other Python GIS packages such as pyproj, Rtree, and Shapely.","1.8.21, 1.9.2, 1.9.5",aces
Firefox,"Firefox is a free, open source Web browser for Windows, Linux and Mac OS X. It is based on the Mozilla code base and offers customization options and features such as its capability to block pop-up windows, tabbed browsing, privacy and security measures, smart searching, and RSS live bookmarks.","118.0.2, 124.0.1",aces
Flask,"Flask is a lightweight WSGI web application framework. It is designed to make getting started quick and easy, with the ability to scale up to complex applications. This module includes the Flask extensions: Flask-Cors","1.1.2, 2.2.2",aces
FlexiBLAS,FlexiBLAS is a wrapper library that enables the exchange of the BLAS and LAPACK implementation used by a program without recompiling or relinking it.,"3.0.4, 3.2.0, 3.2.1, 3.3.1",aces
FreeXL,FreeXL is an open source library to extract valid data from within an Excel (.xls) spreadsheet.,1.0.6,aces
FriBidi,The Free Implementation of the Unicode Bidirectional Algorithm.,"1.0.10, 1.0.12",aces
GATK,"The Genome Analysis Toolkit or GATK is a software package developed at the Broad Institute to analyse next-generation resequencing data. The toolkit offers a wide variety of tools, with a primary focus on variant discovery and genotyping as well as strong emphasis on data quality assurance. Its robust architecture, powerful processing engine and high-performance computing features make it capable of taking on projects of any size.",4.4.0.0-Java-17,aces
GCC,"The GNU Compiler Collection includes front ends for C, C++, Objective-C, Fortran, Java, and Ada, as well as libraries for these languages (libstdc++, libgcj,...).","8.3.0, 10.2.0, 10.3.0, 11.2.0, 11.3.0, 12.2.0, 12.3.0, 13.1.0, 13.2.0",aces
GCCcore,"The GNU Compiler Collection includes front ends for C, C++, Objective-C, Fortran, Java, and Ada, as well as libraries for these languages (libstdc++, libgcj,...).","8.3.0, 10.2.0, 10.3.0, 11.2.0, 11.3.0, 12.2.0, 12.3.0, 13.1.0, 13.2.0",aces
GConf,"GConf is a system for storing application preferences. It is intended for user preferences; not configuration of something like Apache, or arbitrary data storage.",3.2.6,aces
GDAL,"GDAL is a translator library for raster geospatial data formats that is released under an X/MIT style Open Source license by the Open Source Geospatial Foundation. As a library, it presents a single abstract data model to the calling application for all supported formats. It also comes with a variety of useful commandline utilities for data translation and processing.","3.2.1, 3.3.0, 3.3.2, 3.5.0, 3.6.2, 3.7.1",aces
GDB,The GNU Project Debugger,13.2,aces
GDRCopy,A low-latency GPU memory copy library based on NVIDIA GPUDirect RDMA technology.,"2.1-CUDA-11.1.1, 2.2, 2.3, 2.3.1, 2.4",aces
GEOS,GEOS (Geometry Engine - Open Source) is a C++ port of the Java Topology Suite (JTS),"3.9.1, 3.10.3, 3.11.1, 3.12.0",aces
GKlib,A library of various helper routines and frameworks used by Karypis Lab software such as METIS.,"5.1.1, 20231211, 20240119, 20240321, 20240329",aces
GL2PS,GL2PS: an OpenGL to PostScript printing library,1.4.2,aces
GLFW,"GLFW is an Open Source, multi-platform library for OpenGL, OpenGL ES and Vulkan development on the desktop",3.3.8,aces
GLM,OpenGL Mathematics (GLM) is a header only C++ mathematics library for graphics software based on the OpenGL Shading Language (GLSL) specifications.,0.9.9.8,aces
GLPK,"The GLPK (GNU Linear Programming Kit) package is intended for solving large-scale linear programming (LP), mixed integer programming (MIP), and other related problems. It is a set of routines written in ANSI C and organized in the form of a callable library.",5.0,aces
GLib,GLib is one of the base libraries of the GTK+ project,"2.66.1, 2.68.2, 2.69.1, 2.72.1, 2.75.0, 2.77.1",aces
GMP,"GMP is a free library for arbitrary precision arithmetic, operating on signed integers, rational numbers, and floating point numbers.","6.2.0, 6.2.1, 6.3.0",aces
GObject-Introspection,"GObject introspection is a middleware layer between C libraries (using GObject) and language bindings. The C library can be scanned at compile time and generate a metadata file, in addition to the actual native C library. Then at runtime, language bindings can read this metadata and automatically provide bindings to call into the C library.","1.68.0, 1.72.0, 1.74.0, 1.76.1",aces
GRASS,"The Geographic Resources Analysis Support System - used for geospatial data management and analysis, image processing, graphics and maps production, spatial modeling, and visualization","8.2.0, 8.3.1",aces
GROMACS,"GROMACS is a versatile package to perform molecular dynamics, i.e. simulate the Newtonian equations of motion for systems with hundreds to millions of particles. This is a GPU enabled build, containing both MPI and threadMPI builds for both single and double precision. It also contains the gmxapi extension for the single precision MPI build next to PLUMED.","2021.5-CUDA-11.4.1-PLUMED-2.8.0, 2023.1-CUDA-11.7.0, 2023.1-CUDA-12.2.0, 2023.3-CUDA-11.8.0, ...",aces
GSL,"The GNU Scientific Library (GSL) is a numerical library for C and C++ programmers. The library provides a wide range of mathematical routines such as random number generators, special functions and least-squares fitting.","2.6, 2.7",aces
GStreamer,"GStreamer is a library for constructing graphs of media-handling components. The applications it supports range from simple Ogg/Vorbis playback, audio/video streaming to complex audio (mixing) and video (non-linear editing) processing.","1.18.5, 1.20.2, 1.22.1, 1.22.5",aces
GTK2,The GTK+ 2 package contains libraries used for creating graphical user interfaces for applications.,2.24.33,aces
GTK3,"GTK+ is the primary library used to construct user interfaces in GNOME. It provides all the user interface controls, or widgets, used in a common graphical application. Its object-oriented API allows you to construct user interfaces without dealing with the low-level details of drawing and device interaction.","3.24.31, 3.24.35, 3.24.37",aces
GTK4,"GTK+ is the primary library used to construct user interfaces in GNOME. It provides all the user interface controls, or widgets, used in a common graphical application. Its object-oriented API allows you to construct user interfaces without dealing with the low-level details of drawing and device interaction.",4.7.0,aces
GTS,GTS stands for the GNU Triangulated Surface Library. It is an Open Source Free Software Library intended to provide a set of useful functions to deal with 3D surfaces meshed with interconnected triangles.,0.7.6,aces
Gdk-Pixbuf,The Gdk Pixbuf is a toolkit for image loading and pixel buffer manipulation. It is used by GTK+ 2 and GTK+ 3 to load and manipulate images. In the past it was distributed as part of GTK+ 2 but it was split off into a separate package in preparation for the change to GTK+ 3.,"2.42.6, 2.42.8, 2.42.10",aces
